{
  "authority_pointer_ref": "runtime/total_field/ACTIVE_TOTAL_FIELD_AUTHORITY.json",
  "authority_pointer_sha256": "fa8f355bcafa63e8b97a798a5b157f8b5ef3fd2e2d73e043947bb5c99c7587d4",
  "candidate_root": "Taiji_Governance/candidates/t007_v23_global_successor_20261002T124541Z",
  "canonical_ref": "runtime/total_field/master_index/ACTIVE_W7TP_CANONICAL_POINTER.json",
  "contract_mode": "FORMAL_REVIEW",
  "created_at": "2026-10-04T20:46:31.723791Z",
  "dynamic_context": {
    "adi_record_id": "task-state:T-007:6fe6b04c524e81dd",
    "context_ref": "context:task-state:T-007:d0a63473c1a3a3e7",
    "maximum_age_seconds": 1800,
    "packet_sha256": "d0a63473c1a3a3e737dd74866a5f94c09581874f84a74f73d7b6787fdd22e4cd",
    "pulled_at": "2026-10-04T20:45:23.358788+00:00",
    "record_sha256": "91b213811614e5c1509dad2b08c0f0d61012057bda1b6a3fbb14d67c2ac00e1b"
  },
  "expires_at": "2026-10-04T20:50:58.338864Z",
  "founder_authorization_ref": "Taiji_Governance/candidates/t007_v23_global_successor_20261002T124541Z/authorization/renewal_20261004T202058Z/FOUNDER_G1_G3_AUTHORIZATION.json",
  "founder_authorization_sha256": "bf905b64c990c4c4ad119a82ceb7175c1361a61b1b156cd980f4f7d2c14b309d",
  "live_bindings": {
    "current_field": {
      "ref": "runtime/total_field/active/ACTIVE_TRUE8D_ALLNODE_CANONICAL.json",
      "sha256": "337aa719443d42dff6477c78a0a5a3e32e9c30a82231a651c6aeb608239260a9"
    },
    "current_field_router": {
      "ref": "runtime/total_field/active/ACTIVE_TRUE8D_ALLNODE_WITH_ROUTER_CANONICAL.json",
      "sha256": "4f15212984d06f7d39ad7727aa2006b493425da3f797ae3aa134b9f292091d90"
    },
    "total_field_authority": {
      "ref": "runtime/total_field/ACTIVE_TOTAL_FIELD_AUTHORITY.json",
      "sha256": "fa8f355bcafa63e8b97a798a5b157f8b5ef3fd2e2d73e043947bb5c99c7587d4"
    }
  },
  "manifest_sha256": "5a375de4e5b1ff0a233ec506ab4d7e14ddd9fcfcc5b240d298abc19f55066c3d",
  "non_execution_assertions": {
    "canonical_change": false,
    "core_write": false,
    "db_write": false,
    "deploy": false,
    "formal_decision_creation": false,
    "formal_seal_creation": false,
    "git_write": false,
    "network_change": false,
    "pointer_change": false,
    "restart": false
  },
  "nonce": "nonce:sha256:3b6be89ef6c198ebd6c026bd608a144f310d8043b6e2ea9814944c119926371d",
  "package_bindings": {
    "authority_successor_receipt": {
      "ref": "Taiji_Governance/candidates/t007_v23_global_successor_20261002T124541Z/review_completion_20261002T184158Z/AUTHORITY_SUCCESSOR_RECEIPT_CANDIDATE.json",
      "sha256": "ed4da22bc61dcfff356e62f03ecc4e42e81e67414c130a132579068977a90ca0"
    },
    "consumer_rebind_matrix": {
      "ref": "Taiji_Governance/candidates/t007_v23_global_successor_20261002T124541Z/03_ACTIVE_CONSUMER_REBIND_MATRIX.json",
      "sha256": "d37292fdd3bb590e8b2b2766a4a1a73684a9e3927730fe08a104e8edb4d73013"
    },
    "current_field_successor": {
      "ref": "Taiji_Governance/candidates/t007_v23_global_successor_20261002T124541Z/review_completion_20261002T184158Z/CURRENT_8D_FIELD_SUCCESSOR.json",
      "sha256": "26ff223a1ce77ccf3430fa203cc8f694f36f4fbeb516e88e073ae023687fb6ce"
    },
    "founder_directive": {
      "ref": "Taiji_Governance/candidates/t007_v23_global_successor_20261002T124541Z/00_FOUNDER_DIRECTIVE.json",
      "sha256": "7b417541c79bb1ac5f5c44101fecb1cf9aa9ea5151a3dcf97ddeec5d6a8bbac0"
    },
    "successor_contract": {
      "ref": "Taiji_Governance/candidates/t007_v23_global_successor_20261002T124541Z/review_completion_20261002T184158Z/GLOBAL_SUCCESSOR_CONTRACT.json",
      "sha256": "24153c61bf2c67db7575a1df4ffc33f80e01e2700650d45f609bf29237632580"
    }
  },
  "packet_type": "TOTAL_FIELD_SUCCESSOR_REBIND_REVIEW_REQUEST",
  "predecessor_pointer_sha256": "1c3c99631998a95d6909128a64bb68a40af00266b5bbb5cf5695938cf49a5aed",
  "predecessor_version": "2.1",
  "replay_guard": {
    "domain": "T007_GLOBAL_SUCCESSOR_FORMAL",
    "ledger_ref": "runtime/total_field/authority_artifacts/T007_G1_G3_REPLAY",
    "on_replay": "HOLD_SUCCESSOR_REBIND_REVIEW",
    "single_use": true
  },
  "request_id": "request:T007:GLOBAL:FORMAL:RENEWAL:20261004T204631Z",
  "request_self_hash_algorithm": "SHA256_CANONICAL_JSON_EXCLUDING_REQUEST_SELF_SHA256/1.0",
  "request_self_sha256": "8bd8c2f1b6754714e8c4fc581286eecdeaf397aacb9f7b0e58564a59badab274",
  "requested_decision": "SUCCESSOR_REBIND_APPROVED",
  "review_scope": "GLOBAL_CANONICAL_SUCCESSOR",
  "run_id": "T007_V23_GLOBAL_SUCCESSOR_20261002T124541Z",
  "schema_version": "W7TP-TOTAL-FIELD-SUCCESSOR-REBIND-REVIEW-REQUEST/2.0",
  "successor_version": "2.3",
  "task_id": "T-007"
}
